<?xml version="1.0" encoding="UTF-8"?>
<bookInfo xmlns="http://example.com/5" xmlns:xsi="http://www.w3.org/2001/XMLSchema-instance"
	xsi:schemaLocation="http://example.com/5 5.xsd">
	<bookSort>2sadasdasd</bookSort>
	<book type="technology">
		<name>XML Schema应用</name>
		<quantity>2</quantity>
		<price>20</price>
	</book>
	<book type="noveld">
		<name>疯狂程序员</name>
		<quantity>3</quantity>
		<price>15</price>
	</book>
	<book type="history">
		<name>三国志</name>
		<quantity>1</quantity>
		<price>30</price>
	</book>

</bookInfo>
